タスク名,ステータス,タグ,優先度,担当者,期限,要約
プロジェクトの企画書を書く,完了,,,,"June 5, 2023",このプロジェクト案は、第3四半期におけるモバイルパフォーマンスへの投資について、部門間で認識合わせすることを目的としています。ゴールは、ユーザーストーリーと具体的なプロブレムステートメントの追加です。リーダーシップの承認取得、ユーザーリサーチからの学びのまとめはスコープ外です。ネクストステップには、モバイルチームからのフィードバック収集、社内広報との協力による適切なSlackチャンネルでの認知度の向上が設定されています。
新規タスクを追加する,未着手,,,,"June 9, 2023",このドキュメントでは、タスク追跡システムに新規タスクを追加する手順をご説明します。タスクID、担当者、ステータス、期限、優先度、タグは、タスクごとにカスタマイズできます。
チームメンバーを招待する,未着手,,,,"July 1, 2023",このドキュメントでは、チームメンバーを招待して、タスクで共同作業するための手順をご説明します。「共有」メニューを使用してチームメンバーを招待し、「担当者」フィールドを使用してタスクを割り当てます。チームメンバーには、サイドバーに通知が届きます。
データダッシュボードを構築する,未着手,,,,"June 7, 2023",このタスクでは、コントロールグループに対するアクティベーションとリテンションを測定するためのデータダッシュボードを構築し、複数の部門のパートナーが新しいユーザーコホートに対するツールヒントの有効性に関する情報を各自で入手できるようにします。ネクストステップには、JonnyへのHexアクセス権依頼、フィードバックやリクエストのための部門間会議の予定調整が含まれます。ツールヒントがスキップされる頻度のトラッキングはスコープ外です。
リサーチ結果をレビューする,未着手,,,,"June 18, 2023",このドキュメントには、リサーチタスクのゴールとスコープ外（教育がさらに必要なプロダクト領域の理解、エンゲージメントの高い領域の優先順位の引き下げ）について概要がまとめられています。ネクストステップでは、10件のインタビューを確認し、Slackで気づきを共有します。
キックオフミーティングの予定を調整する,進行中,,,,"June 4, 2023",このタスクは進行中であり、パフォーマンスプロジェクトのキックオフミーティングの予定調整、会議資料の事前準備、全ステークホルダーの会議への招待が含まれます。追加のパフォーマンスプロジェクトについてのブレインストーミングはスコープ外です。期限は2023年4月26日で、優先度は中です。タスクは「モバイル」としてタグ付けされています。
